;Имидж;Статус;Престиж
Прилагательные определения;позитивный, положительный, сценический, благоприятный, негативный;особый, правовой, нейтральный, внеблоковый, адвокатский;былой, невысокий, международный, высочайший, низкий
Объект/Прямое дополнение;подпортить, портить, улучшить, подправить, испортить;придать, присвоить, закрепить, обрести, получить;ронять, подрывать, поднять, уронить, поднимать
Субъект/Роль подлежащего;закрепиться, улучшиться, потускнеть, сформироваться, поблекнуть;обязывать, закрепиться, позволять, сохраняться, давать;пошатнуться, падать, повышаться, упасть, повыситься
Косв. объект;вредить, повредить, навредить, наносить, нанести;лишить, наделить, наделять, лишиться, лишать;наносить, повредить, нанести, дорожить, навредить
Обстоятельство;сказываться, сказаться, отразиться, вязаться, отражаться;претендовать, приравнять, пребывать, приравнеть, перевести;откачать, радеть, ударить, сказываться, наплевать
Однородные;имидж, репутация, престиж, привлекательность, авторитет;статус, амнистия, полномочие, положение, льгота;привлекательность, авторитет, престиж, имидж, значимость
